business idea,success score,explanation
"Mobile Car Detailing",9,"Reddit consensus: Consistently cited as easiest to start with $100-500 in supplies. Immediate cash flow, low overhead, recurring revenue potential. Multiple Redditors report $100k+ revenue within first year. High demand in suburbs and cities. Failure rate extremely low because you start with one client and scale organically."
"Residential Cleaning Services",8,"Reddit success stories show cleaning businesses scaling to $400k+ revenue with just $100 startup costs. Service-based businesses have higher initial success rates than product businesses. 42% of business failures are due to no market need - cleaning always has demand. Low barrier to entry but strong recurring revenue if you focus on commercial/regular residential clients."
"Equipment Rental",8,"Reddit r/Entrepreneur users report 'crazy margins - people will pay 20% of purchase price per rental'. Low competition in many areas. High demand from contractors and DIYers. Can start with 2-3 tools ($1-2k) and scale profitably. Construction equipment rental frequently cited as recession-resistant with consistent ROI."
"Home Repair/Handyman Services",8,"Reddit r/smallbusiness identifies this as 'easy to start and be profitable'. No market need issues - every homeowner needs repairs. Can start solo with basic tools. Cash business with immediate payment. Word-of-mouth marketing works exceptionally well. Scale challenge is hiring, but solo operator success rate is very high."
"Pressure Washing Service",7,"Reddit r/Entrepreneur frequently lists this alongside car detailing as 'chuck and a truck' businesses that work. $500-1000 equipment cost. High seasonal demand. Commercial clients provide recurring revenue. Low skill barrier but high perceived value. Physical work weeds out competition."
"E-commerce (High-Margin Niche)",7,"Reddit r/smallbusiness notes 'businesses where you have a brand and sell products at huge markup' like cosmetics, eco-products succeed. Digital products have zero inventory risk. However, 42% fail from no market need. Success depends entirely on finding underserved niche. High ceiling but moderate success probability."
"Property Management",6,"Growing demand cited in business articles with platforms like Airbnb. Reddit hosts debate this - profitable in tourist areas but location-dependent. Requires no property ownership. Can start managing 1-2 units part-time. Success rate moderate due to competition and platform dependency."
"Consulting (Professional)",6,"Reddit r/Entrepreneur recommends consulting as low-risk startup. Zero capital required - selling your existing knowledge. Immediate cash flow. High success rate for those with 5+ years industry experience. Lower score because requires specialized expertise most don't have. Failure comes from consultants without real expertise."
"Micro SaaS (Niche)",5,"Reddit r/SaaS shows bootstrapped successes ($1.5M ARR examples), but Reddit r/Entrepreneur warns 'product builds slowly' and has lower initial success rate. SaaS businesses can hit 30-40% net margins. However, 29% of businesses fail from running out of cash - SaaS requires longer runway. High potential but lower probability than services."
"Food Truck",5,"Reddit r/smallbusiness mentions pizza shops and Chinese carry-out as 'high profit, low overhead'. Food trucks have lower overhead than restaurants. However, food businesses have higher regulatory burden and failure rates. Success heavily location and operator-dependent. Moderate probability due to proven demand but operational complexity."
"Laundromat",5,"Not heavily discussed on Reddit but known in small business circles. Equipment rental model with space. Reddit r/smallbusiness mentions 'high profit, low overhead' models succeed in small towns. Requires significant capital ($100k+). Success probability moderate because demand is consistent but competition and equipment costs are high."
"Liquor/Convenience Store",4,"Reddit r/smallbusiness identifies these as 'most successful' in small towns. High margins and steady demand. However, requires $150k+ startup capital, licensing complexity, and location is critical. High failure rate if location is wrong. Lower score due to capital barrier and regulatory risk despite proven model."
"Franchise (Established Brand)",4,"Reddit mentions franchise benefits: recognized brand, training, support. However, requires $50k-500k capital. Royalties eat margins. Success rate higher than independent startups but still significant failure risk. Many franchisees fail due to undercapitalization. Moderate probability but high cost barrier."
"Vending Machine Business",6,"Minimal Reddit discussion but aligns with equipment rental model. Low startup ($2-3k/machine), passive income potential. High success rate if locations are good. Failure comes from poor location selection. Scale challenges but individual machine success rate is high. Score reflects proven model with moderate scalability."
"Mobile Pet Grooming",7,"Reddit r/Entrepreneur includes 'dog grooming' in service business successes. Mobile version has lower overhead than storefront. Recurring revenue from loyal clients. Growing pet industry. Can start with van/equipment for $10-15k. Higher startup than detailing but also higher ticket prices and client loyalty."
"Digital Products (Templates/Courses)",6,"Reddit r/Entrepreneur lists digital products as low-risk startups. Zero marginal cost, infinite scalability. However, 42% fail from no market need. Success requires existing audience or marketing skills. Lower initial success probability than services but zero capital requirement boosts score. Creating for established niche works best."
